{
  "build_command_policy": "docker buildx build --load --platform linux/amd64 with OCI source labels",
  "build_metadata_reference": "outputs/security/supply-chain/build-metadata.json",
  "build_metadata_sha256": "d9ab41ee13d2f9b6553734fac9b4b18e20e5f7674a5e646fa91af442bc3574f9",
  "canonical_trivy_finding_ids": [
    "FND-CONTAINER-026cbd40a3d8",
    "FND-CONTAINER-3b7728ab6349",
    "FND-CONTAINER-3d855e8b31a4",
    "FND-CONTAINER-43d127b610b8",
    "FND-CONTAINER-452f02c62efd",
    "FND-CONTAINER-4b3599117c60",
    "FND-CONTAINER-5464624f68ba",
    "FND-CONTAINER-54f909a65e8d",
    "FND-CONTAINER-57b96cf12bee",
    "FND-CONTAINER-5a8d530b00be",
    "FND-CONTAINER-6017bcc173f8",
    "FND-CONTAINER-65d0909407ea",
    "FND-CONTAINER-65d75e6eba4f",
    "FND-CONTAINER-6884a6a2aeb3",
    "FND-CONTAINER-6e659fb03bfe",
    "FND-CONTAINER-7401651d82c4",
    "FND-CONTAINER-75484f7ebb4b",
    "FND-CONTAINER-77763b149b4f",
    "FND-CONTAINER-8229cd4d151d",
    "FND-CONTAINER-84d155fdc3d1",
    "FND-CONTAINER-85c29f2e1d67",
    "FND-CONTAINER-866a375b43af",
    "FND-CONTAINER-87e329c9d3c9",
    "FND-CONTAINER-8917d095a4d4",
    "FND-CONTAINER-8c4116b09936",
    "FND-CONTAINER-9448e15df1ef",
    "FND-CONTAINER-97d0d191781c",
    "FND-CONTAINER-a05776d7b2eb",
    "FND-CONTAINER-a44acae763a2",
    "FND-CONTAINER-a6116dba2666",
    "FND-CONTAINER-b11df2b9097e",
    "FND-CONTAINER-b32479e41fff",
    "FND-CONTAINER-b49f58b918ed",
    "FND-CONTAINER-b9d1bbc8febf",
    "FND-CONTAINER-c1e6ced9904f",
    "FND-CONTAINER-c269596a605e",
    "FND-CONTAINER-c29de2c95e6d",
    "FND-CONTAINER-c31d90a0dae9",
    "FND-CONTAINER-cdafc2f07851",
    "FND-CONTAINER-d7e9ab84f9e9",
    "FND-CONTAINER-e1d4cd41e57c",
    "FND-CONTAINER-e1f2cc1c749d",
    "FND-CONTAINER-e9c4b1dd55ff",
    "FND-CONTAINER-f6f763380649",
    "FND-SUPPRESSIO-5313851a0158",
    "FND-SUPPRESSIO-ef559061de8d"
  ],
  "container_scan_reference": "outputs/security/supply-chain/container-scan-summary.json",
  "container_scan_sha256": "88a470cdb3649bc81d3cd1217843b24c8a10dd32236e92bcaa7c64fb75c26a0d",
  "dependency_definition_sha256": "a7d4b5321d5c7251804e9ab86458633553c4ccd752ccc03811dd933362cc11ba",
  "dockerfile_sha256": "5a260d10297f75a3b6676c2175c6a1245595ce1f3ddcebad40b93b60f21fccca",
  "dockerignore_sha256": "20d754a54d1890b43c4a220e921750e9ff5bfced834f2c397d0b4e1e83c5c55d",
  "image_digest": "sha256:4cf7c5e4472e227388bb9fed5b87781bc1b8d0833dc699edce96f3116bee28ec",
  "predicate_type": "https://devsecops.example/supply-chain/provenance/v1",
  "publication_eligibility_reference": "outputs/security/supply-chain/publication-eligibility.json",
  "release_decision": "conditional_pass",
  "release_decision_id": "REL-4e403b3e4f2106df",
  "release_decision_reference": "outputs/security/release/release-gate-decision.json",
  "release_decision_sha256": "b6192bbbbf2a91c5a6a929c690f23e51963a005c4cb8ffa3b64d01fbff00665a",
  "sbom_reference": "outputs/security/supply-chain/container-sbom.cdx.json",
  "sbom_sha256": "2e6c73c257fff01acadee31932ee036e12d9c77e477ac39f972c72539ab9e24a",
  "schema_version": "1.0",
  "source_commit": "7bc2106054f197fdd432ce11412aede926764812",
  "source_repository": "https://github.com/Ibraheemolasupogit/devsecops-application-security-pipeline"
}
